{
  "dataset_name": "RS-Tampering-Unified-Demo",
  "version": "1.0.0",
  "root_dir": "data",
  "label_space": {
    "l1": [
      "authentic",
      "manipulated",
      "fully_generated",
      "unknown"
    ],
    "l2": [
      "copy_move",
      "splice",
      "inpainting_removal",
      "inpainting_replacement",
      "aigc_global",
      "none",
      "uncertain"
    ]
  },
  "files": {
    "samples": "sample_records.json",
    "questions": "question_records.json"
  }
}