{
  "dataset_name": "remote_sensing_tamper_unified_demo",
  "version": "v1.0",
  "root_dir": "demo",
  "label_space": {
    "l1": [
      "authentic",
      "manipulated",
      "fully_generated",
      "unknown"
    ],
    "l2": [
      "copy_move",
      "splice",
      "inpainting_removal",
      "inpainting_replacement",
      "aigc_global",
      "none",
      "uncertain"
    ]
  },
  "files": {
    "samples": "examples/sample_records_demo.json",
    "questions": "examples/question_records_demo.json"
  }
}